Date,Settlement Date,Symbol,Sedol,Quantity,Price,Description,Reference,Debit,Credit,Running Balance
01/04/2024,01/04/2024,,,n/a,n/a,DEBIT CARD PAYMENT,TOPUP001,,5000.00,5000.00
03/04/2024,05/04/2024,VOD,BH4HKS3,1000,0.6954,VODAFONE GROUP PLC ORD USD0.20 20/21 : 1000 @ 0.6954,B240403001,703.35,,4296.65
03/04/2024,05/04/2024,VHYL,BK8VW78,10,45.50,VANGUARD FTSE ALLWLD HIGH DIVIDEND YIELD : 10 @ 45.50,B240403002,462.95,,3833.70
30/04/2024,30/04/2024,,,n/a,n/a,MONTHLY SERVICE PLAN FEE,FEE240430,4.99,,3828.71
15/05/2024,15/05/2024,VOD,BH4HKS3,n/a,n/a,DIVIDEND PAYMENT VODAFONE GROUP PLC,DIV240515,,38.50,3867.21
10/06/2024,12/06/2024,VOD,BH4HKS3,"1,000",0.7215,VODAFONE GROUP PLC ORD USD0.20 20/21 : 1000 @ 0.7215,S240610001,,713.55,4580.76
01/07/2024,01/07/2024,,,n/a,n/a,INTEREST ON CASH BALANCE,INT240701,,1.25,4582.01
26/09/2024,26/09/2024,VHYL,BK8VW78,n/a,n/a,DIVIDEND PAYMENT VANGUARD FTSE ALLWLD HIGH DIVIDEND YIELD,DIV240926,,5.12,4587.13
